created_at;id_str;full_text;quote_count;reply_count;retweet_count;favorite_count;lang;user_id_str;conversation_id_str;username;tweet_url
Sun Aug 27 12:08:19 +0000 2023;1695770215567835261;"ganjar   pranowo for presiden 2024, mantap pak ganjar #GanjarCapres https://t.co/7ofTyHWcMP";0;1;0;0;in;1564418290641817602;1695770213290312000;indo_pejuang;https://twitter.com/indo_pejuang/status/1695770215567835261
Sun Aug 27 12:08:19 +0000 2023;1695770213290312000;"ganjar   pranowo sudah paling tepat menjadi presiden di 2024 #GanjarCapres https://t.co/xy6DvZmlBG";0;1;0;0;in;1564418290641817602;1695770213290312000;indo_pejuang;https://twitter.com/indo_pejuang/status/1695770213290312000
Sun Aug 27 12:08:17 +0000 2023;1695770203802796388;"Ganjar sebut fondasi yg dibangun jokowi harus diteruskan. #GanjarBawaRIMaju";0;0;0;1;in;1600467192360816640;1695770203802796388;NKRIBerbicara;https://twitter.com/NKRIBerbicara/status/1695770203802796388
Sun Aug 27 12:08:15 +0000 2023;1695770197184147578;"Indonesia negara yang besar butuh pemimpin yang sehat dan kuat seperti pak Jokowi, dan itu ada di Ganjar bukan di Prabowo. https://t.co/5Wask8b5tX";0;0;0;0;in;1589857328735526913;1695770197184147578;fitriya20510869;https://twitter.com/fitriya20510869/status/1695770197184147578
Sun Aug 27 12:08:12 +0000 2023;1695770184563433872;"Kalau arah dukungan pasti ke Ganjar, namun saling mementori ini yang sangat menarik !  Tags: #AFFKacau THANK YOU INDRA HERLAMBANG misono THANK YOU EXO YaSi Dwi Sasono Yaqiong bonus 20x lipat Seo Seung Jae Chae Yu Jung Soodam Taesan Islam ヒロミさん PriFad https://t.co/HWhFkUMf6q";0;1;0;0;ja;1607246740784295939;1695770184563433872;IndoGanjar;https://twitter.com/IndoGanjar/status/1695770184563433872
Sun Aug 27 12:08:11 +0000 2023;1695770181090603471;"Ganjar Pranowo memang mantap https://t.co/40gfwkWuD1";0;0;0;0;in;1618042673381920769;1695770181090603471;vanirfula;https://twitter.com/vanirfula/status/1695770181090603471
Sun Aug 27 12:07:57 +0000 2023;1695770122399760767;"@FenisiaPhoenix @psi_id 🤟🤟🤟";0;0;0;0;qme;1607246740784295939;1695714578985062602;IndoGanjar;https://twitter.com/IndoGanjar/status/1695770122399760767
Sun Aug 27 12:07:40 +0000 2023;1695770050068893716;"Ganjar apresiasi pemuda muhamadiyah. #GanjarBawaRIMaju";0;0;0;1;in;1600467192360816640;1695770050068893716;NKRIBerbicara;https://twitter.com/NKRIBerbicara/status/1695770050068893716
Sun Aug 27 12:07:32 +0000 2023;1695770015726023139;"Pak Ganjar &amp  Bu Atikoh memang pasangan yg luar biasa 🥰❤️  Tags: #AFFKacau THANK YOU INDRA HERLAMBANG misono THANK YOU EXO YaSi Dwi Sasono Yaqiong bonus 20x lipat Seo Seung Jae Chae Yu Jung Soodam Taesan Islam ヒロミさん PriFad https://t.co/ngudZnU8Wn";0;1;0;0;ja;1604106140106620933;1695770015726023139;NatashaArini2;https://twitter.com/NatashaArini2/status/1695770015726023139
Sun Aug 27 12:07:20 +0000 2023;1695769965465625047;"@arifin34533 @Miduk17 cak imin k ganjar. pendukung pkb gusdur pindah. 🤣 🤣 🤣";0;0;0;0;in;2384764039;1695424567987319261;ArekNdeso79;https://twitter.com/ArekNdeso79/status/1695769965465625047
Sun Aug 27 12:07:10 +0000 2023;1695769924185268512;"Ganjar sebut ekonomi hijau dan transformasi digital kunci membangun indonesia masa depan. #GanjarBawaRIMaju";0;0;0;1;in;1600467192360816640;1695769924185268512;NKRIBerbicara;https://twitter.com/NKRIBerbicara/status/1695769924185268512
Sun Aug 27 12:06:44 +0000 2023;1695769814902739154;"Siapa yang masih bilang Ganjar tak punya gagasan ? Heran !  Soodam #生放送で卍解 最下位転落 手紙割愛 misono PriFad #千鳥の鬼レンチャン ヒロミさん 国民的アイドル Chae Yu Jung 中国の日本人学校 伊代さん 有働さん #いわきFC THANK YOU EXO 伊代ちゃん 借金生活 笑点引退 レックウザ YaSi https://t.co/3eKqIqIVNO";0;0;0;0;ja;1601476468881571840;1695769814902739154;SuryaFjri;https://twitter.com/SuryaFjri/status/1695769814902739154
Sun Aug 27 12:06:20 +0000 2023;1695769714864316632;"@NgkongRoses Pilek,flu pusing karena masuk angin emang jos makan ini. Siap2 tisu sambil makan krn pasti melernya banjir😀😀";0;1;0;1;in;1516760361986576391;1695761981356257494;tussam_mountain;https://twitter.com/tussam_mountain/status/1695769714864316632
Sun Aug 27 12:06:17 +0000 2023;1695769700566016077;"@RikzaRobbi @Miduk17 iya. tp buzzer ganjar tak paham. 🤣 🤣 🤣";0;0;0;0;in;2384764039;1695424567987319261;ArekNdeso79;https://twitter.com/ArekNdeso79/status/1695769700566016077
Sun Aug 27 12:06:13 +0000 2023;1695769687148396556;"Ganjar hadiri silaturahmi masyayikh seindonesia  #GanjarBawaRIMaju";0;0;0;1;in;1600467192360816640;1695769687148396556;NKRIBerbicara;https://twitter.com/NKRIBerbicara/status/1695769687148396556
Sun Aug 27 12:05:59 +0000 2023;1695769625684856899;"Ganjar Pranowo sosok yang dikeroyok terkena playing victim, Ganjar dan PDIP adalah seorang dan partai yang terzolimi dan dikhianati #GanjarCapres #GanjarPresiden2024 #ganjarpranowo #ganjar #sahabatganjar #relawanganjar #jawatengah #jateng #GanjarDikeroyok https://t.co/iMJYCnf6og";0;0;0;0;in;2790750052;1695769625684856899;GanjarJTG;https://twitter.com/GanjarJTG/status/1695769625684856899
Sun Aug 27 12:05:58 +0000 2023;1695769621528519098;"JANJI ENTASKAN KEMISKINAN JIKA GANJAR JADI PRESIDEN, HALAH JATENG DI PIMPIN GANJAR JADI PROVINSI TERMISKIN https://t.co/zMtbpXhanZ #jokowi #PDIP #ganjarpranowofans https://t.co/WoMGZ9fzqF";0;0;0;1;in;1614230469444534272;1695769621528519098;ERABARU17691191;https://twitter.com/ERABARU17691191/status/1695769621528519098
Sun Aug 27 12:05:57 +0000 2023;1695769616268898805;"Ganjar   Pranowo Siap Menjadi Capres 2024. #GanjarCapres https://t.co/lOZ8cbzvRQ";0;0;0;0;in;1564418290641817602;1695769606554865860;indo_pejuang;https://twitter.com/indo_pejuang/status/1695769616268898805
Sun Aug 27 12:05:56 +0000 2023;1695769613806792824;"Dukung   ganjar jadi presiden 2024. #GanjarCapres https://t.co/lVot0j3m92";0;1;0;0;in;1564418290641817602;1695769606554865860;indo_pejuang;https://twitter.com/indo_pejuang/status/1695769613806792824
Sun Aug 27 12:05:55 +0000 2023;1695769608899490144;"Rakyat   Dukung Ganjar Jadi Presiden. #GanjarCapres https://t.co/Xb4uOpXCbe";0;1;0;0;in;1564418290641817602;1695769606554865860;indo_pejuang;https://twitter.com/indo_pejuang/status/1695769608899490144
Sun Aug 27 12:05:50 +0000 2023;1695769587605025114;"Dukung Ganjar Pranowo, Ganjar Pranowo adalah sosok yang dikhianati #GanjarCapres #GanjarPresiden2024 #ganjarpranowo #ganjar #sahabatganjar #relawanganjar #jawatengah #jateng #GanjarDikeroyok https://t.co/YkAi3RZ9yr";0;0;0;0;in;2790750052;1695769587605025114;GanjarJTG;https://twitter.com/GanjarJTG/status/1695769587605025114
Sun Aug 27 12:05:46 +0000 2023;1695769572308382199;"Pak Ganjar &amp  Bu Atikoh memang pasangan yg luar biasa 🥰❤️  Soodam #生放送で卍解 最下位転落 手紙割愛 misono PriFad #千鳥の鬼レンチャン ヒロミさん 国民的アイドル Chae Yu Jung 中国の日本人学校 伊代さん 有働さん #いわきFC THANK YOU EXO 伊代ちゃん 借金生活 笑点引退 レックウザ YaSi https://t.co/cgRMUbq4pM";0;0;0;0;ja;1614527701456654336;1695769572308382199;DiaryTugiman;https://twitter.com/DiaryTugiman/status/1695769572308382199
Sun Aug 27 12:05:40 +0000 2023;1695769547994014185;"Ganjar Pranowo selalu difitnah. Sebagai pemimpin, Ganjar Pranowo tidak pernah mempermasalahkannya dan justru semakin dicintai rakyat #GanjarCapres #GanjarPresiden2024 #ganjarpranowo #ganjar #sahabatganjar #relawanganjar #jawatengah #jateng #GanjarDikeroyok https://t.co/ePyuKfZe5J";0;0;0;0;in;2790750052;1695769547994014185;GanjarJTG;https://twitter.com/GanjarJTG/status/1695769547994014185
Sun Aug 27 12:05:36 +0000 2023;1695769531657154563;"@B3doel___ @ganjarpranowo Pantau, lacak, menangkan Ganjar  Ganjar Presiden 2024";0;0;0;2;in;1385449485472395271;1695767390603428030;RstmBcl;https://twitter.com/RstmBcl/status/1695769531657154563
Sun Aug 27 12:05:17 +0000 2023;1695769452112191679;"Ganjar di sambut meriah para santri. #GanjarBawaRIMaju https://t.co/ZSTgpRVF1x";0;0;0;1;in;1600467192360816640;1695769452112191679;NKRIBerbicara;https://twitter.com/NKRIBerbicara/status/1695769452112191679
Sun Aug 27 12:05:07 +0000 2023;1695769409976193045;"habis melipir ke prabowo ntar melipir ke ganjar..hayodah liat aja..😀😀";0;0;0;0;in;1603596405460725762;1695769409976193045;PakJenggot___;https://twitter.com/PakJenggot___/status/1695769409976193045
Sun Aug 27 12:04:59 +0000 2023;1695769376329486371;"Ganjar Pranowo dekat dengan ulama  #Apple #EXOxSCARLETT #AFFKacau Minggu Sore Mas Adi Onana Wasitnya Dipelihara Shibal LISA AWES LOS ANGELES PARK JISUNG THANK YOU Cukup Cream Soda Tasyi Ragil Inkigayo https://t.co/4cy46Ly47O";0;1;0;0;in;1568943347028627457;1695769376329486371;lulu_kanya;https://twitter.com/lulu_kanya/status/1695769376329486371
Sun Aug 27 12:04:46 +0000 2023;1695769318905283055;"Ganjar sebut jokowi berhasil bangun konektivitas digital. #GanjarBawaRIMaju https://t.co/HDCRJzzEuI";0;0;0;1;in;1600467192360816640;1695769318905283055;NKRIBerbicara;https://twitter.com/NKRIBerbicara/status/1695769318905283055
Sun Aug 27 12:04:38 +0000 2023;1695769286260957658;"Ganjar pranowo jalin kerukunan dan silaturahmi Masyayikh se-indonesia. https://t.co/hvblQO0ZWX";0;1;0;1;in;1357241653673615360;1695769239314223491;CahyaniIka3;https://twitter.com/CahyaniIka3/status/1695769286260957658
Sun Aug 27 12:04:34 +0000 2023;1695769269244756363;"Dukung Ganjar https://t.co/69epRoX5pE";0;1;0;1;in;1357241653673615360;1695769239314223491;CahyaniIka3;https://twitter.com/CahyaniIka3/status/1695769269244756363
Sun Aug 27 12:04:34 +0000 2023;1695769268384874601;"Ganjar Pranowo Tampung Aspirasi Anak Muda, Peduli Milenial dan Gen z https://t.co/u9fKzkDOU0";0;0;0;0;in;1661896883483316225;1695769268384874601;ud24185000;https://twitter.com/ud24185000/status/1695769268384874601
Sun Aug 27 12:04:30 +0000 2023;1695769254874980450;"Ganjar dekat dengan Ulama. https://t.co/lowXdNDl34";0;1;0;1;in;1357241653673615360;1695769239314223491;CahyaniIka3;https://twitter.com/CahyaniIka3/status/1695769254874980450
Sun Aug 27 12:04:22 +0000 2023;1695769218091045019;"Ganjar Pranowo Tampung Aspirasi Anak Muda, Peduli Milenial dan Gen z https://t.co/kQYoHV9X9m";0;0;0;0;in;1661896883483316225;1695769218091045019;ud24185000;https://twitter.com/ud24185000/status/1695769218091045019
Sun Aug 27 12:04:15 +0000 2023;1695769192371478860;"Jangan lewatkan momen spesial pada tanggal 29 Agustus 2023! NDX AKA akan menghadirkan pengalaman tak terlupakan dengan peluncuran eksklusif lagu "Pemenang Ganjar: Banteng Metu Kandang".  #SahabatGanjar #GanjarPranowo #Ganjar #GenerasiGotongRoyong #GanjarPresiden #GanjarUntukSemua https://t.co/KeKOiqQqaF";0;0;0;0;in;1366400355366432768;1695769192371478860;awan_mer4h;https://twitter.com/awan_mer4h/status/1695769192371478860
Sun Aug 27 12:04:15 +0000 2023;1695769192077914459;"Ganjar Pranowo Tampung Aspirasi Anak Muda, Peduli Milenial dan Gen z https://t.co/ooqqvTXpsG";0;0;0;0;in;1661896883483316225;1695769192077914459;ud24185000;https://twitter.com/ud24185000/status/1695769192077914459
Sun Aug 27 12:04:13 +0000 2023;1695769181067809084;"@DelicaSugeng @WinSamb @abwnews_ jadi kalo misal Pendukung Ganjar itu ada yg bunuh orang.  yg salah ganjar gt ya? hehehe";0;0;0;0;in;1476181318618599424;1695623740967842224;UsoppKun88;https://twitter.com/UsoppKun88/status/1695769181067809084
Sun Aug 27 12:04:10 +0000 2023;1695769169898393694;"Artine ulama ngandelake Ganjar kanggo dadi presidhen ing 2024  Soodam 最下位転落 #千鳥の鬼レンチャン 手紙割愛 misono PriFad #生放送で卍解 ヒロミさん 国民的アイドル Chae Yu Jung 中国の日本人学校 伊代さん 有働さん #いわきFC THANK YOU EXO 伊代ちゃん 借金生活 笑点引退 レックウザ YaSi https://t.co/e6kVM55J1x";0;0;0;0;ja;1614532538378375168;1695769169898393694;BersuaRakyat;https://twitter.com/BersuaRakyat/status/1695769169898393694
Sun Aug 27 12:04:10 +0000 2023;1695769167868367171;"Ganjar Pranowo Presiden 2024 pilihanku, Ganjar sosok ayah teladan dan dikagumi Ulama #GanjarPresiden #GanjarCapres2024 https://t.co/7QBiPrWJg9";0;0;0;0;in;1571560183159226368;1695769167868367171;MelissaKumbang;https://twitter.com/MelissaKumbang/status/1695769167868367171
Sun Aug 27 12:04:08 +0000 2023;1695769159186235781;"Ganjar doring kebutuhan PPPK guru. #GanjarBawaRIMaju https://t.co/gCSVvFcjSn";0;0;0;1;in;1600467192360816640;1695769159186235781;NKRIBerbicara;https://twitter.com/NKRIBerbicara/status/1695769159186235781
Sun Aug 27 12:04:06 +0000 2023;1695769153003766077;"Launching lagu NDX AKA 15.00 WIB di Cibis Park Cilandak Selasa 29 Agustus 2023 "Pemenang Ganjar: Banteng Metu Kandang" bisa buat kamu nge hip hop until night 🎊  GRATIS bin MANIS 🌹  #SahabatGanjar #GenerasiGotongRoyong #GanjarPresiden #GanjarUntukSemua https://t.co/ODRD9xHwhM";0;0;3;3;in;1240137086331748352;1695769153003766077;Penyair_Berdiri;https://twitter.com/Penyair_Berdiri/status/1695769153003766077
Sun Aug 27 12:04:04 +0000 2023;1695769143742808307;"Ganjar Pranowo Presiden 2024 pilihanku, Ganjar sosok ayah teladan dan dikagumi Ulama #GanjarPresiden #GanjarCapres2024 https://t.co/grUSUzvjDq";0;0;0;0;in;1571560183159226368;1695769143742808307;MelissaKumbang;https://twitter.com/MelissaKumbang/status/1695769143742808307
Sun Aug 27 12:04:00 +0000 2023;1695769127108174117;"Ganjar Pranowo Presiden 2024 pilihanku, Ganjar sosok ayah teladan dan dikagumi Ulama #GanjarPresiden #GanjarCapres2024 https://t.co/Jlrkay8LrF";0;0;0;0;in;1571560183159226368;1695769127108174117;MelissaKumbang;https://twitter.com/MelissaKumbang/status/1695769127108174117
Sun Aug 27 12:03:54 +0000 2023;1695769101568983477;"@Kenikir27 @prabowo Nah dengerin "Insya Allah Ganjar, bukan Prabowo dan bukan Anies"  Puas ???";0;0;0;0;in;1535903868;1695435466177409354;Wdp1407Widy;https://twitter.com/Wdp1407Widy/status/1695769101568983477
Sun Aug 27 12:03:53 +0000 2023;1695769099941650664;"Ganjar Pranowo Presiden 2024 pilihanku, Ganjar sosok ayah teladan dan dikagumi Ulama #GanjarPresiden #GanjarCapres2024 https://t.co/wS1OiHe3vd";0;0;0;0;in;1571560183159226368;1695769099941650664;MelissaKumbang;https://twitter.com/MelissaKumbang/status/1695769099941650664
Sun Aug 27 12:03:49 +0000 2023;1695769079876038892;"Ganjar Pranowo Presiden 2024 pilihanku, Ganjar sosok ayah teladan dan dikagumi Ulama #GanjarPresiden #GanjarCapres2024 https://t.co/y9v0gzREk3";0;0;0;0;in;1571560183159226368;1695769079876038892;MelissaKumbang;https://twitter.com/MelissaKumbang/status/1695769079876038892
Sun Aug 27 12:03:46 +0000 2023;1695769068752740678;"#Apple #EXOxSCARLETT #AFFKacau Minggu Sore Mas Adi Onana Wasitnya Dipelihara Shibal LISA AWES LOS ANGELES PARK JISUNG THANK YOU Cukup Cream Soda Tasyi Ragil Inkigayo https://t.co/Rt1NRMKVLI";0;0;0;0;in;1684753359075700736;1695769068752740678;ganjargercep;https://twitter.com/ganjargercep/status/1695769068752740678
Sun Aug 27 12:03:40 +0000 2023;1695769044107030847;"#Apple #EXOxSCARLETT #AFFKacau Minggu Sore Mas Adi Onana Wasitnya Dipelihara Shibal LISA AWES LOS ANGELES PARK JISUNG THANK YOU Cukup Cream Soda Tasyi Ragil Inkigayo https://t.co/IytGWnWua5";0;0;0;0;in;1684753359075700736;1695769044107030847;ganjargercep;https://twitter.com/ganjargercep/status/1695769044107030847
Sun Aug 27 12:03:32 +0000 2023;1695769011521540180;"#Apple #EXOxSCARLETT #AFFKacau Minggu Sore Mas Adi Onana Wasitnya Dipelihara Shibal LISA AWES LOS ANGELES PARK JISUNG THANK YOU Cukup Cream Soda Tasyi Ragil Inkigayo https://t.co/GiKT7JWgBi";0;0;0;0;in;1684753359075700736;1695769011521540180;ganjargercep;https://twitter.com/ganjargercep/status/1695769011521540180
Sun Aug 27 12:03:31 +0000 2023;1695769006920409588;"@Paramitha234 @ganjarpranowo Pak ganjar yes";0;0;0;0;in;1632958414140874752;1695434869348978974;DianaDiah12;https://twitter.com/DianaDiah12/status/1695769006920409588
Sun Aug 27 12:03:30 +0000 2023;1695769003405554096;"@Bentir16 @Clla0508 @KakekHalal Takoni ganjar ya ora jelas https://t.co/qflZco1bzX";0;0;0;0;in;2348307679;1695103010123513941;sptakr;https://twitter.com/sptakr/status/1695769003405554096
Sun Aug 27 12:03:07 +0000 2023;1695768906420662390;"Pak Ganjar &amp  Bu Atikoh memang pasangan yg luar biasa~! 🥰❤️  PriFad #生放送で卍解 ヒロミさん 国民的アイドル misono Soodam 最下位転落 #千鳥の鬼レンチャン 手紙割愛 Chae Yu Jung 中国の日本人学校 伊代さん 有働さん #いわきFC THANK YOU EXO 伊代ちゃん 借金生活 笑点引退 レックウザ YaSi https://t.co/D3yIXO1iB2";0;0;0;0;ja;1593867543076548608;1695768906420662390;FrisahaK;https://twitter.com/FrisahaK/status/1695768906420662390
Sun Aug 27 12:02:45 +0000 2023;1695768814158491845;"Ganjar sang penerus Jokowi!  #Apple #EXOxSCARLETT #AFFKacau Minggu Sore Mas Adi Onana Wasitnya Dipelihara Shibal LISA AWES LOS ANGELES PARK JISUNG THANK YOU Cukup Cream Soda Tasyi Ragil Inkigayo https://t.co/MMjfWsN5Cl";0;0;2;19;in;1555467795227607040;1695768814158491845;JokowiHokage;https://twitter.com/JokowiHokage/status/1695768814158491845
Sun Aug 27 12:02:34 +0000 2023;1695768768344162607;"Dari body gesture dan pukulan2 nya kayaknya #Prifad di #BWC2023 bakal di ganjar Medali Perak.. gemes liatnya  @BadmintonTalk @INABadminton   Anyhow, Good Job lah 👏👏";0;0;0;0;in;44050013;1695768768344162607;dico_harefa;https://twitter.com/dico_harefa/status/1695768768344162607
Sun Aug 27 12:02:27 +0000 2023;1695768737964757497;"Skenario Panas Menggulingkan Posisi Ganjar Sebagai Capres 2024! 🤥 https://t.co/jUZv5yidvV";0;0;0;0;in;1590515883327115264;1695768737964757497;tita_evi;https://twitter.com/tita_evi/status/1695768737964757497
Sun Aug 27 12:02:21 +0000 2023;1695768711591006638;"Artine ulama ngandelake Ganjar kanggo dadi presidhen ing 2024  PriFad #生放送で卍解 ヒロミさん 国民的アイドル misono Soodam 最下位転落 #千鳥の鬼レンチャン 手紙割愛 Chae Yu Jung 中国の日本人学校 伊代さん 有働さん #いわきFC THANK YOU EXO 伊代ちゃん 借金生活 笑点引退 レックウザ YaSi https://t.co/yInUqQ28zU";0;0;0;0;ja;1608760672271368198;1695768711591006638;NusantaraNews01;https://twitter.com/NusantaraNews01/status/1695768711591006638
Sun Aug 27 12:02:18 +0000 2023;1695768698626424993;"Skenario Panas Menggulingkan Posisi Ganjar Sebagai Capres 2024! 😚 https://t.co/Gd7lx10BJr";0;0;0;0;in;1589880402520420353;1695768698626424993;charlie6255;https://twitter.com/charlie6255/status/1695768698626424993
Sun Aug 27 12:02:10 +0000 2023;1695768666082828419;"@YRadianto Tuanku ya Rakyat, Gubernur Hanya Mandat   Ttd.  Ganjar Pranowo ~ Gedung Nusantara 1";0;0;0;0;in;253959872;1695419737126375864;m_hudananta;https://twitter.com/m_hudananta/status/1695768666082828419
Sun Aug 27 12:01:59 +0000 2023;1695768619693838793;"Skenario Panas Menggulingkan Posisi Ganjar Sebagai Capres 2024! 🥰 https://t.co/fZLuJ34q37";0;0;0;0;in;1589878980534243329;1695768619693838793;gavin9952;https://twitter.com/gavin9952/status/1695768619693838793
Sun Aug 27 12:01:55 +0000 2023;1695768602161656252;"Ganjar berkomitmen beri kesejahteraan para guru di jateng. #GanjarBawaRIMaju https://t.co/NWNbxNUIHK";0;0;0;2;in;1600467192360816640;1695768602161656252;NKRIBerbicara;https://twitter.com/NKRIBerbicara/status/1695768602161656252
Sun Aug 27 12:01:48 +0000 2023;1695768571992047924;"Skenario Panas Menggulingkan Posisi Ganjar Sebagai Capres 2024! 😟 https://t.co/jtMkjFXvEk";0;0;0;0;in;1589877935640825856;1695768571992047924;celine8548;https://twitter.com/celine8548/status/1695768571992047924
Sun Aug 27 12:01:45 +0000 2023;1695768559916584986;"PPP Bicara soal Absen di Apel Pemenangan Ganjar di Semarang https://t.co/w9JYRDBB1f";0;0;0;0;in;598959076;1695768559916584986;20detik;https://twitter.com/20detik/status/1695768559916584986
Sun Aug 27 12:01:38 +0000 2023;1695768533899395363;"Skenario Panas Menggulingkan Posisi Ganjar Sebagai Capres 2024! https://t.co/4uj8bmZCXW";0;0;0;0;in;1589857328735526913;1695768533899395363;fitriya20510869;https://twitter.com/fitriya20510869/status/1695768533899395363
Sun Aug 27 12:01:27 +0000 2023;1695768485253779928;"Timses Ganjar (PDIP) Mainannya Kasar, Licik dan Tidak Sportif https://t.co/QfDeJ5CFnP";0;1;2;9;in;887743587579944960;1695768485253779928;OposisiCerdas;https://twitter.com/OposisiCerdas/status/1695768485253779928
Sun Aug 27 12:01:17 +0000 2023;1695768442580898229;"Pak Ganjar &amp  Bu Atikoh memang pasangan yg luar biasa ❤️  PriFad #生放送で卍解 ヒロミさん 国民的アイドル misono Soodam 最下位転落 #千鳥の鬼レンチャン 手紙割愛 Chae Yu Jung 中国の日本人学校 伊代さん 有働さん #いわきFC THANK YOU EXO 伊代ちゃん 借金生活 笑点引退 レックウザ YaSi https://t.co/14OPTGhCpy";0;0;0;0;ja;1601166770718769152;1695768442580898229;DellaPrihatiwi;https://twitter.com/DellaPrihatiwi/status/1695768442580898229
Sun Aug 27 12:01:03 +0000 2023;1695768383663530294;"Bakal Calon Presiden (Bacapres) Ganjar Pranowo mengagumi sikap kemaslahatan dari para ulama saat menghadiri acara Silaturahmi Masyayikh se-Indonesia.   #SahabatGanjar #GanjarPranowo #Ganjar #GenerasiGotongRoyong #GanjarPresiden #GanjarUntukSemua https://t.co/xhA4DrZdPs";0;0;0;0;in;1366400355366432768;1695768383663530294;awan_mer4h;https://twitter.com/awan_mer4h/status/1695768383663530294
Sun Aug 27 12:00:51 +0000 2023;1695768334049198444;"Ganjar di beri gelar gubernur punakawan. #GanjarBawaRIMaju https://t.co/IkKkVrn3YO";0;0;0;1;in;1600467192360816640;1695768334049198444;NKRIBerbicara;https://twitter.com/NKRIBerbicara/status/1695768334049198444
Sun Aug 27 12:00:30 +0000 2023;1695768248485290280;"@Darmawan_bs @mahdiequintana @haniafiair @AyamSegar3 @yudiwibowo976 @Joker_Wedoks @Indones1aku @Paramitha234 @Doddy19714254 @denni_sauya Ganjar Gass PooL 🤟";0;0;0;1;in;2546567134;1695741916397338721;chandraLaras22;https://twitter.com/chandraLaras22/status/1695768248485290280
Sun Aug 27 12:00:30 +0000 2023;1695768247973618027;"@AgusssBaskoro @ShenoWirang Tapi percuma, lagi lagi negara ini dipimpin para elit pdip, buat apa, tetap sama donggggg, yg jadi persoalan beberapa org ga suka pak jokowi aja itu karena beliau org pdip, udh semua org tau pdip gimana, kalo pak ganjar maju dan terpilih, yasudah berputar di lingkaran api, sama!";0;0;0;0;in;1092728810938675200;1695192174714048834;itsnciss;https://twitter.com/itsnciss/status/1695768247973618027
Sun Aug 27 12:00:27 +0000 2023;1695768233926963289;"Diharapkan rakyat jadi penerus Ibu Iriana 🥰  PriFad #生放送で卍解 ヒロミさん 国民的アイドル misono Soodam 最下位転落 #千鳥の鬼レンチャン 手紙割愛 Chae Yu Jung 中国の日本人学校 伊代さん 有働さん #いわきFC THANK YOU EXO 伊代ちゃん 借金生活 笑点引退 レックウザ YaSi https://t.co/w2fPa5nQd6";0;0;0;0;ja;1609759856881434624;1695768233926963289;ganjar_gayeng;https://twitter.com/ganjar_gayeng/status/1695768233926963289
Sun Aug 27 12:00:09 +0000 2023;1695768159574454444;"Ganjar di apresiasi ketua KPK. #GanjarBawaRIMaju https://t.co/DKXOnaq53K";0;0;0;1;in;1600467192360816640;1695768159574454444;NKRIBerbicara;https://twitter.com/NKRIBerbicara/status/1695768159574454444
Sun Aug 27 12:00:07 +0000 2023;1695768149336179040;"@mahdiequintana @haniafiair @AyamSegar3 @yudiwibowo976 @Joker_Wedoks @Indones1aku @Darmawan_bs @Paramitha234 @Doddy19714254 @denni_sauya Yeaaach  Gass kan Ganjar Pranowo 🤟";0;0;0;1;in;2546567134;1695741916397338721;chandraLaras22;https://twitter.com/chandraLaras22/status/1695768149336179040
Sun Aug 27 12:00:04 +0000 2023;1695768137646715223;"@SalimCipok @ganjarpranowo 🥰🥰🥰";0;0;0;0;qme;1609759856881434624;1695720689985303024;ganjar_gayeng;https://twitter.com/ganjar_gayeng/status/1695768137646715223
Sun Aug 27 12:00:01 +0000 2023;1695768123738075242;"Bonus Special Mystery Box untuk para member aktif dan setia berhadiah UANG TUNAI!  hanya di DEWACASH  https://t.co/zGPHcepFz2  #dewacash #BahkanVoli nasib papera Ernando #paperapedagangsejahtera Dwi Sasono series horor terbaik pantau lacak menangkan ganjar The Actors Apri";0;0;0;1;in;2254737469;1695768123738075242;judipokerINDO;https://twitter.com/judipokerINDO/status/1695768123738075242
Sun Aug 27 11:59:52 +0000 2023;1695768087063355876;"Pak Ganjar &amp  Bu Atikoh memang pasangan yg luar biasa 🥰  PriFad #生放送で卍解 ヒロミさん 国民的アイドル misono Soodam 最下位転落 #千鳥の鬼レンチャン 手紙割愛 Chae Yu Jung 中国の日本人学校 伊代さん 有働さん #いわきFC THANK YOU EXO 伊代ちゃん 借金生活 笑点引退 レックウザ YaSi https://t.co/inGdZBKjUf";0;0;0;0;ja;1601124730592907264;1695768087063355876;AnisaNurfalah9;https://twitter.com/AnisaNurfalah9/status/1695768087063355876
Sun Aug 27 11:59:49 +0000 2023;1695768075994570880;"Mohon Doa Ke Pimpinan Ponpes, Des Ganjar Ikut Pengajian Alumni Malnu Banten https://t.co/GL3k8dLbff";0;0;0;0;in;981351767253311488;1695768075994570880;IdTopmedia;https://twitter.com/IdTopmedia/status/1695768075994570880
Sun Aug 27 11:59:25 +0000 2023;1695767974307881385;"Ganjar berhasil terapkan ekonomi sirkular. #GanjarBawaRIMaju https://t.co/8cYOoZzROo";0;0;0;1;in;1600467192360816640;1695767974307881385;NKRIBerbicara;https://twitter.com/NKRIBerbicara/status/1695767974307881385
Sun Aug 27 11:59:10 +0000 2023;1695767909061316777;"Perlindungan &amp  Pemberdayaan Pelaku Usaha Perikanan &amp  Pergaraman, Perlindungan &amp  Pemenuhan Hak Penyandang Disabilitas, &amp  Tata Kelola Sistem Pemasaran Hasil Pertanian, Perikanan &amp  Produk UMKM. Ganjar berharap 3 Perda ini bisa dijadikan pedoman bagi pemerintah dlm proses eksekutif.";0;0;1;1;in;2431310970;1695767905319977061;wantahgdn__;https://twitter.com/wantahgdn__/status/1695767909061316777
