created_at;id_str;full_text;quote_count;reply_count;retweet_count;favorite_count;lang;user_id_str;conversation_id_str;username;tweet_url
Sun Aug 27 11:47:06 +0000 2023;1695764875526701229;"Ganjar menyebut banyak program Jokowi yang baik dan bisa ia lanjutkan mulai dari infrastruktur, hingga program kreatif untuk UMKM. 😎🇮🇩 Ganjar Pranowo  https://t.co/bvAd7bOjAm";0;0;9;11;in;1978790995;1695764875526701229;LaingenLisa;https://twitter.com/LaingenLisa/status/1695764875526701229
Sun Aug 27 11:47:05 +0000 2023;1695764868807508002;"Ganjar pranowo dekat dengan ulama dan gen milenial !! Pemimpin terbaik https://t.co/2mtUNbmb9X";0;0;0;0;in;1579385961766481920;1695761886451810767;SarahLalejumbo;https://twitter.com/SarahLalejumbo/status/1695764868807508002
Sun Aug 27 11:47:00 +0000 2023;1695764848070791553;"@tifsembiring Ganjar dan wowo saling serang dan bersaing... Alhamdulillah... Semoga ada yg di untungkan...";0;0;0;0;in;1073405263766409216;1695626166030455143;ARH41178799;https://twitter.com/ARH41178799/status/1695764848070791553
Sun Aug 27 11:46:54 +0000 2023;1695764824062566819;"Dalam usahanya untuk meningkatkan kawasan rekreasi, Ganjar mengusung ide revitalisasi yang berfokus pada konsep lingkungan yang lestari.  #GanjarBawaRIMaju THANK YOU EXO bonus 20x lipat Tailetian X BIBLE LISA AWES LOS ANGELES EXO GLOW TO YOU Shibal Inkigayo Ragil Dwi Sasono https://t.co/q1GAL9Mg9g";0;0;1;1;in;1614190757673570304;1695764824062566819;SumbarForGanjar;https://twitter.com/SumbarForGanjar/status/1695764824062566819
Sun Aug 27 11:46:52 +0000 2023;1695764815443284318;"Ganjar pranowo dekat dengan ulama dan gen milenial !! Pemimpin terbaik https://t.co/RLdYWsihmR";0;3;0;0;in;1579385961766481920;1695761886451810767;SarahLalejumbo;https://twitter.com/SarahLalejumbo/status/1695764815443284318
Sun Aug 27 11:46:45 +0000 2023;1695764784837525707;"Ganjar Resmikan Perkumpulan Relawan 'RUMAH KITA' di Jaksel https://t.co/eL89FzlZXt";0;0;0;0;in;598959076;1695764784837525707;20detik;https://twitter.com/20detik/status/1695764784837525707
Sun Aug 27 11:46:43 +0000 2023;1695764779779211364;"Ganjar pranowo dekat dengan ulama dan gen milenial !! Pemimpin terbaik https://t.co/hgUPVefCru";0;0;0;0;in;1579385961766481920;1695764779779211364;SarahLalejumbo;https://twitter.com/SarahLalejumbo/status/1695764779779211364
Sun Aug 27 11:46:25 +0000 2023;1695764702549443016;"Demi lompatan besar yang sudah dibangun oleh Presiden @jokowi, Ganjar Pranowo menegaskan kita harus memimpin dan jangan sampai pedot oyot/putus akarnya. @ganjarpranowo https://t.co/jGUmx1iVm9";0;0;0;0;in;875142990;1695764702549443016;AmandaKintania;https://twitter.com/AmandaKintania/status/1695764702549443016
Sun Aug 27 11:45:39 +0000 2023;1695764510316068904;"Lewat 3 PERDA baru, Ganjar beri manfaat untuk masyarakat  Petani perikanan terbantu, penyandang disabilitas makin inklusif hingga UMKM yang semakin diberdayakan  Mudah menjadi pelayam yang amah, tanpa PIDATO2, tanpa KONFERENSI PERS  #GanjarUntukIndonesia https://t.co/kiI5Sl81dp";0;18;20;53;in;1102461866129776640;1695764510316068904;Miduk17;https://twitter.com/Miduk17/status/1695764510316068904
Sun Aug 27 11:45:25 +0000 2023;1695764450874368235;"Menanti 170 hari kian naik elektabilitas dar Ganjar Pranowo.  Setiap Capres hanya Tuhan yg tahu dan seijin Dialah yg jadi Presiden 2024. https://t.co/pEMWoVvVuo";0;0;0;1;in;1586285162232283136;1695764450874368235;tandangalfons67;https://twitter.com/tandangalfons67/status/1695764450874368235
Sun Aug 27 11:44:52 +0000 2023;1695764312823087401;"Rampungan manggung kok selak pngn nonton Newcastle";0;1;0;1;in;60583637;1695764312823087401;KingGaseng;https://twitter.com/KingGaseng/status/1695764312823087401
Sun Aug 27 11:44:45 +0000 2023;1695764281088958719;"Disambut dengan lantunan Sholawat, Ganjar Pranowo menghadiri silaturahmi Masyayikh se Indonesia di Pondok Pesantren At Taujieh Al Islamy 2 Andalusia Banyumas. @ganjarpranowo https://t.co/zB0KTlQHAP";0;0;0;0;in;875142990;1695764281088958719;AmandaKintania;https://twitter.com/AmandaKintania/status/1695764281088958719
Sun Aug 27 11:44:39 +0000 2023;1695764257844154732;"Wacana Duet Ganjar-Anies di Pilpres 2024 Sulit Terwujud Karena Punya Tujuan Koalisi Berbeda https://t.co/y4SJP1Rb6q";0;0;0;0;in;2356034352;1695764257844154732;rachell_za;https://twitter.com/rachell_za/status/1695764257844154732
Sun Aug 27 11:44:18 +0000 2023;1695764169440866763;"@nalar_logis @AirinDatangLagi yaelah dasar alap2nya ganjar tukang spin. justru jawaban untuk BPJS malah dipotong https://t.co/MebOlomhAV";3;0;1;2;in;2963337276;1695718161201668472;Quvvatt;https://twitter.com/Quvvatt/status/1695764169440866763
Sun Aug 27 11:44:08 +0000 2023;1695764126013038650;"Masih juga kalian tidak yakin bahwa Jabar tidak bisa ditaklukan? Lihat ini, hampir di setiap acara relawan Ganjar, masyarakat selalu antusias menyambut kedatangan PDIP,. Magnet Ganjar Pranowo kali ini benar2 meruntuhkan sekat anti PDIP selama ini.";0;0;11;9;in;1677662458167836673;1695764126013038650;lolina_321lagi;https://twitter.com/lolina_321lagi/status/1695764126013038650
Sun Aug 27 11:44:07 +0000 2023;1695764122699464851;"Halo Sahabat!  Sahabat Ganjar sukses menggelar dua acara besar di Kota Makassar, Sulawesi Selatan.   #SahabatGanjar #GanjarPranowo #Ganjar #GenerasiGotongRoyong #GanjarPresiden #GanjarUntukSemua https://t.co/0q0AavyN7Z";0;0;0;1;in;1366400355366432768;1695764122699464851;awan_mer4h;https://twitter.com/awan_mer4h/status/1695764122699464851
Sun Aug 27 11:44:07 +0000 2023;1695764121667641569;"Dulu pendukung Pak Jokowi sibuk ngomongin kelebihan Pak Jokowi.  Sekarang pendukung Pak Ganjar sibuk ngomongin kejelekan Pak Prabowo.  Now you spot the difference 🫣😬";0;0;0;1;in;1208328361015005184;1695764121667641569;fxchandra03;https://twitter.com/fxchandra03/status/1695764121667641569
Sun Aug 27 11:43:39 +0000 2023;1695764007955865726;"Alhamdulillah survey trakhir ini mnunjukan semakin maju pak ganjar , ini bukti rakyt mnginginkan program jokowi berlanjut https://t.co/MGeWzY4hDV";0;0;0;0;in;1613097395499458561;1695764007955865726;wapemla;https://twitter.com/wapemla/status/1695764007955865726
Sun Aug 27 11:43:28 +0000 2023;1695763958526029986;"@otterlylou @patroclouis ganjar😭😭😭";0;1;0;0;in;999183477919498241;1695713762639282235;louicinema;https://twitter.com/louicinema/status/1695763958526029986
Sun Aug 27 11:42:45 +0000 2023;1695763780939215281;"Untuk memenangkan Ganjar Pranowo, Ketua DPP  PDI Perjuangan Puan Maharani penegasan untuk menjaga Jawa Tengah sebagai kandang banteng. @PDI_Perjuangan  @ganjarpranowo https://t.co/YQMlHjUXLl";0;0;0;0;in;875142990;1695763780939215281;AmandaKintania;https://twitter.com/AmandaKintania/status/1695763780939215281
Sun Aug 27 11:42:44 +0000 2023;1695763773444051175;"Menyusul lg Sulawesi Tenggara...... Ribuan warga deklarasi dukung @ganjarpranowo Presiden Indonesia 2024. Yang Benar.... Pilih Ganjar.... 💪🤟🤟🇮🇩🇮🇩 https://t.co/omJXClAapm";0;0;5;8;in;2939656405;1695763773444051175;panjianom102;https://twitter.com/panjianom102/status/1695763773444051175
Sun Aug 27 11:42:41 +0000 2023;1695763762752651753;"@AbidinZnl @__AnakKolong Ganjar Praroro 🤣";0;0;0;0;in;1208090877895139328;1695737295440338950;Mastjuk72;https://twitter.com/Mastjuk72/status/1695763762752651753
Sun Aug 27 11:42:30 +0000 2023;1695763715667435847;"Yang ingin jadi orang kaya, sila pilih Anies Baswedan.  Maju kotanya bahagia warganya.  Yang ingin jadi orang miskin, sila pilih Ganjar Pranowo.   #MisteriKematian894KPPS  #MisteriKematian894KPPS https://t.co/AdMPo0zjRp";0;0;0;1;in;1373967328979787779;1695763715667435847;bianca01403;https://twitter.com/bianca01403/status/1695763715667435847
Sun Aug 27 11:42:19 +0000 2023;1695763668833890780;"Sehat selalu Pak Ganjar Pranowo.. Tetep putih mboten ngalih!";0;0;0;0;in;1354413021607550986;1695763668833890780;SukoharjoTf;https://twitter.com/SukoharjoTf/status/1695763668833890780
Sun Aug 27 11:42:11 +0000 2023;1695763637133361561;"@Yayoledug @Jr_Kawe19 @Urrangawak @ganjarpranowo @WagimanDeep212_ Gas poll Kuat, satukan tekad menangkan Ganjar pranowo🤟🇲🇨";0;1;0;2;in;1385449485472395271;1695703835350798767;RstmBcl;https://twitter.com/RstmBcl/status/1695763637133361561
Sun Aug 27 11:41:15 +0000 2023;1695763400448786611;"@ganjarpranowo indomie seleraku  ganjar presidenku";0;0;0;0;in;1606882096995532802;1695619104982601982;rudiromdoni2;https://twitter.com/rudiromdoni2/status/1695763400448786611
Sun Aug 27 11:40:57 +0000 2023;1695763327195197605;"@__RismaWidiono_ @_Rizmaya__ @PDI_Perjuangan @ganjarpranowo Melaju bersama Ganjar.... 👍";0;0;0;1;in;1635862509201805312;1695757321723642322;PakRoy453165598;https://twitter.com/PakRoy453165598/status/1695763327195197605
Sun Aug 27 11:39:57 +0000 2023;1695763074979144155;"Tahun 2024 Pilih President ABG ( Asal Bukan Ganjar )🇮🇩";0;0;0;0;in;1458991478114377732;1695763074979144155;BaharudinRenof4;https://twitter.com/BaharudinRenof4/status/1695763074979144155
Sun Aug 27 11:39:43 +0000 2023;1695763017042940369;"Sabar mas bud biarkan semua pendukung ganjar puas2in nyablak nya toh mereka semua otak nya kotor abaikan saja nnt jiga cape sendri berhenti sendri";0;0;0;1;in;1004873472626122752;1695763017042940369;c1mplung_82;https://twitter.com/c1mplung_82/status/1695763017042940369
Sun Aug 27 11:39:00 +0000 2023;1695762834678784350;"Anies Bertemu Petinggi 3 Parpol Koalisi Perubahan saat Ramai Isu Duet dengan Ganjar, Bahas Cawapres?  #Pilpres2024 #capres #Anies #Ganjar #KoalisiPerubahan  https://t.co/Djd4wyu04m lewat @tribunkaltim";0;0;0;0;in;103551225;1695762834678784350;tribunkaltim;https://twitter.com/tribunkaltim/status/1695762834678784350
Sun Aug 27 11:38:45 +0000 2023;1695762774532792463;"@KakekHalal Sebelum menyeruduk para penghambat kemajuan Negara...Capres Ganjar Pranowo MADANG dulu biar kuat nyruduknya. https://t.co/Y3mqzCS8bx";0;0;0;0;in;4893253992;1695432447889150188;HadiSan75818338;https://twitter.com/HadiSan75818338/status/1695762774532792463
Sun Aug 27 11:38:05 +0000 2023;1695762603480584312;"@ferdinand_mpu @ganjarpranowo @PDI_Perjuangan Brati Pak ganjar siap membawa perubahan total dari rezim jokowik sekarang,tetapi ngak mau mngakuinya.Hebat PKI new.. + pandai membuat strategi kebohongan trbaru.";0;0;0;0;in;1580182162103365632;1695615265420279905;arjabul14;https://twitter.com/arjabul14/status/1695762603480584312
Sun Aug 27 11:37:57 +0000 2023;1695762573139079574;"@bubarbubar @ch_chotimah2 @grace_nat @psi_id @Giring_Ganesha Lht saja nanti Feeling saya diantara Prabowo atau Ganjar hanya satu yg lolos putaran II. Entah Prabowo, entah Ganjar";0;0;0;0;in;545264533;1695636614679253034;WAHYU_UNIFORM;https://twitter.com/WAHYU_UNIFORM/status/1695762573139079574
Sun Aug 27 11:37:51 +0000 2023;1695762548279447910;"Rakyat e pak ganjar 😭😭😭";0;0;0;0;in;1612828604580388864;1695762548279447910;obannyaayas;https://twitter.com/obannyaayas/status/1695762548279447910
Sun Aug 27 11:37:48 +0000 2023;1695762534362738927;"BERGETAR !!! PERLIHATKAN TONGKAT BUNG KARNO, PUAN PERINTAHKAN MENANGKAN ... https://t.co/dVrYtLJzGi via @YouTube #puan #nyaleg #pdip #ganjar  #tongkatbungkarno";0;0;0;0;in;1397024000342036481;1695762534362738927;SAFANews3;https://twitter.com/SAFANews3/status/1695762534362738927
Sun Aug 27 11:37:25 +0000 2023;1695762437256208641;""Elektabilitas Ganjar salip Prabowo" Ya begitulah isu berita malam ini di  MetroTV. Bung Rocky "pembuat Hoax terbaik adalah penguasa. Karena mereka memiliki seluruh peralatan untuk berbohong, dari media, data, intelejen, dll. Jadi hanya mereka pembuat kebohongan dengan sempurna".";0;0;0;1;in;1455867712551284746;1695762437256208641;Aa_Lombok;https://twitter.com/Aa_Lombok/status/1695762437256208641
Sun Aug 27 11:36:59 +0000 2023;1695762327768084770;"METRO TV METRO SIANG : Minggu, 27 Agustus 2023 - 12:52 WIB  SAHABAT GANJAR MELANTIK TIM PANTAU LACAK DAN MENANGKAN GANJAR SEBAGAI GARDA PENGAWAL GANJAR PRANOWO DI SOSIAL MEDIA  Jakarta  "Kegiatan yang dilaksanakan oleh Sahabat Ganjar ini penting, karena saat ini kita tidak hanya… https://t.co/1ehjAWIUAQ";0;0;0;1;in;1230994530083565568;1695762327768084770;sahabatganjar;https://twitter.com/sahabatganjar/status/1695762327768084770
Sun Aug 27 11:36:30 +0000 2023;1695762204765917207;"@Miduk17 makanya usung sendiri paslon ganjar-puan, yg penting internal solid, pasang baliho puan dihampir semua daerah itu mahal, wajar elit internal uring2an, bohong kl ga ada gesekan, hasto aja bilang ada problem dialektika partai, dukung cmn 1/2 hati sekalipun bu ketum udah bertitah.";0;0;0;0;in;1501720500560482309;1695742266969923852;LimDelaopan;https://twitter.com/LimDelaopan/status/1695762204765917207
Sun Aug 27 11:36:01 +0000 2023;1695762086604001746;"@jubaedi_abed @fadlizon @prabowo Iyakk ganjar menang nantj Prabowo merapat, jadi Menteri urusan Lansia..., yerus 5 thn lg nyalon lagi dia pas umurnya 78.. wkwkwwk";0;0;0;0;in;2817296563;1695642515498803654;BajakLaut369;https://twitter.com/BajakLaut369/status/1695762086604001746
Sun Aug 27 11:35:54 +0000 2023;1695762054861537365;"Ganjar pranowo capres terbaik siap pimpin indonesia 2024 https://t.co/egmfpqMnhh";0;1;0;0;in;1579385961766481920;1695761886451810767;SarahLalejumbo;https://twitter.com/SarahLalejumbo/status/1695762054861537365
Sun Aug 27 11:35:42 +0000 2023;1695762005083476339;"@OposisiCerdas Faktanya Jateng menjadi provinsi termiskin di Jawa sejak dipimpin Ganjar !  Jateng Dipimpin Ganjar Jadi Provinsi Termiskin, Menyusul Solo Jadi Kota Termiskin https://t.co/33eNna5UUD";0;0;0;2;in;793427822949769216;1695659210846224883;MgmPtmgm;https://twitter.com/MgmPtmgm/status/1695762005083476339
Sun Aug 27 11:35:38 +0000 2023;1695761986783764909;"Ganjar pranowo capres terbaik siap pimpin indonesia 2024 https://t.co/mkCytTL2SM";0;0;0;0;in;1579385961766481920;1695761886451810767;SarahLalejumbo;https://twitter.com/SarahLalejumbo/status/1695761986783764909
Sun Aug 27 11:35:29 +0000 2023;1695761950653997124;"Ganjar pranowo capres terbaik siap pimpin indonesia 2024 https://t.co/dIxOfDUnwl";0;0;0;0;in;1579385961766481920;1695761886451810767;SarahLalejumbo;https://twitter.com/SarahLalejumbo/status/1695761950653997124
Sun Aug 27 11:35:23 +0000 2023;1695761925496521058;"Ganjar pranowo capres terbaik siap pimpin indonesia 2024 https://t.co/VP1yAPHoId";0;0;0;0;in;1579385961766481920;1695761886451810767;SarahLalejumbo;https://twitter.com/SarahLalejumbo/status/1695761925496521058
Sun Aug 27 11:35:14 +0000 2023;1695761886451810767;"Ganjar pranowo capres terbaik siap pimpin indonesia 2024 https://t.co/5nnVfqnv8o";0;4;0;0;in;1579385961766481920;1695761886451810767;SarahLalejumbo;https://twitter.com/SarahLalejumbo/status/1695761886451810767
Sun Aug 27 11:34:39 +0000 2023;1695761741739880636;"@Miduk17 Yg jelas partai koalisi pendukung ganjar udah mulai gak solid... mereka pd panik skarang.";0;0;0;0;in;1065286570305961984;1695375850051665924;4riq4lfatih;https://twitter.com/4riq4lfatih/status/1695761741739880636
Sun Aug 27 11:34:03 +0000 2023;1695761591218929855;"@yaniarsim @ganjarpranowo @puanmaharani_ri 🤣🤣🤣🤣🤣 gue mending gelput kalau di suruh pilih ganjar";0;0;0;0;in;1577662357932687361;1695323193362579704;TotoForsa;https://twitter.com/TotoForsa/status/1695761591218929855
Sun Aug 27 11:33:57 +0000 2023;1695761565667229733;"@Tan_Mar3M Puan memiliki Trah Soekarno Puan pegang Tongkat Komando #PuanBacapres2024  Gantikan ganjar pranowo! https://t.co/q7nYoj7KPP";0;0;1;0;in;749252554005983232;1695377646744695149;SuramaduJingga;https://twitter.com/SuramaduJingga/status/1695761565667229733
Sun Aug 27 11:33:55 +0000 2023;1695761557651923356;"Ganjar berkomitmen beri kesejahteraan  #GanjarBawaRIMaju https://t.co/HcBeyTf6Vp";0;0;0;0;in;1434801455777517568;1695761557651923356;putrisrikandi_;https://twitter.com/putrisrikandi_/status/1695761557651923356
Sun Aug 27 11:33:17 +0000 2023;1695761396934594945;"oh iya dongs, siapa dulu calon presiden kita ni pak Ganjar 🤗  #ganjarrebound #jatenghappyending #tetappilihganjar #ganjarpranowo #ganjaruntuksemua #kamiganjar #indonesiatangguh https://t.co/h7tRWL9MYj";0;0;0;0;in;1512624641638301698;1695761396934594945;SDGanjar;https://twitter.com/SDGanjar/status/1695761396934594945
Sun Aug 27 11:32:50 +0000 2023;1695761285349277892;"@tvOneNews Cawapresnya ganjar? 🤣🤣🤣 #BasmiPKIBenamkanPDIP";0;0;0;0;in;1569986999997849603;1695754197407510982;IndraZadri;https://twitter.com/IndraZadri/status/1695761285349277892
Sun Aug 27 11:32:45 +0000 2023;1695761263635357770;"2024 yg benar Bersama Ganjar pranowo  menghadirkan harapan baru untuk menuju INDONESIA EMAS 2045 MUDA  ,ENERGIC, CERDAS, RENDAH HATI, PROBLEM SOLVING  ,MERAKYAT REKAM JEJAK MASA LALU BERSIH  KELUARGA HARMONIS BERPRESTASI  JUJUR DAN BERSIH TIDAK KKN. https://t.co/bl9AficOuC";0;3;6;15;in;1144772185229160449;1695761263635357770;eddy_widodo_165;https://twitter.com/eddy_widodo_165/status/1695761263635357770
Sun Aug 27 11:32:29 +0000 2023;1695761196417527856;"@StefanAntonio__ Jujurly Puan memng kompeten dlm komunikasi politik dg elit" partai dan eksekutif sdg pak Ganjar hanya aktivis partai yg pegiat media informasi dan komunikasi publik dan pemuda🥴";0;0;0;0;in;4742233640;1695631864739049936;zyiqyu26;https://twitter.com/zyiqyu26/status/1695761196417527856
Sun Aug 27 11:32:19 +0000 2023;1695761154944176456;"@yudiwibowo976 @Yurissa_Samosir @bos_sir @MuhiqR @NohCeukenohhh @Kang_Toniee @mustafaagus007 @Azri_Ardhani @doelpaten @choymarkochoy @Dunianyasantai @__g_h_c_g_h_c__ Lha ganjar suka nonton bokep aja di expose masa' yg positif begini gak di expose bong";0;0;0;1;in;1491755569870688257;1695423279744622883;MirzaIskandar15;https://twitter.com/MirzaIskandar15/status/1695761154944176456
Sun Aug 27 11:32:02 +0000 2023;1695761083733303797;"@siticeriaselalu @ganjar_pranowo @NilaWati375469 🤣🤣🤣🤭";0;1;0;0;qme;1248538148990152704;1695739937273053664;Ghurem2;https://twitter.com/Ghurem2/status/1695761083733303797
Sun Aug 27 11:32:00 +0000 2023;1695761074556166316;"Dukung ganjar, walaupun telah dikhianati #GanjarCapres  THANK YOU INDRA HERLAMBANG #AFFKacau #VindesSport #AFFU23 Fadia Apri #BWC2023 Seo Seung Jae YaSi Besok Senin https://t.co/QxZVrb57sO";0;0;0;0;in;1669249935550865408;1695761058282234246;NusantaraProtec;https://twitter.com/NusantaraProtec/status/1695761074556166316
Sun Aug 27 11:31:59 +0000 2023;1695761071091708365;"Bung Iko (Budiman Sudjatmiko) Percaya kalau yang inline dalam pemikiran soal kepemimpinan strategik adalah Prabowo Subianto. Bacapres lain punya kelebihan. Ganjar Populis, Anies Intelektualis, tapi yang strategis hanya Prabowo.   #prabowo #prabowosubianto #budimansudjatmiko… https://t.co/l3Z4MZxded";0;0;0;1;in;1576913175227748352;1695761071091708365;dekade_08;https://twitter.com/dekade_08/status/1695761071091708365
Sun Aug 27 11:31:58 +0000 2023;1695761065097998741;"Ganjar pranowo pasti bisa melanjutkan presiden jokowi #GanjarCapres  THANK YOU INDRA HERLAMBANG #AFFKacau #VindesSport #AFFU23 Fadia Apri #BWC2023 Seo Seung Jae YaSi Besok Senin https://t.co/XYYHLT0oqI";0;1;0;0;in;1669249935550865408;1695761058282234246;NusantaraProtec;https://twitter.com/NusantaraProtec/status/1695761065097998741
Sun Aug 27 11:31:56 +0000 2023;1695761058282234246;"Jangan biarkan ganjar sendiri, rakyat tetap bersama ganjar #GanjarCapres  THANK YOU INDRA HERLAMBANG #AFFKacau #VindesSport #AFFU23 Fadia Apri #BWC2023 Seo Seung Jae YaSi Besok Senin https://t.co/JdqZC0B1S6";0;1;0;0;in;1669249935550865408;1695761058282234246;NusantaraProtec;https://twitter.com/NusantaraProtec/status/1695761058282234246
Sun Aug 27 11:31:21 +0000 2023;1695760911838122322;"Ganjar Unggul Survei Karena Gagasan  Oleh : Angwar Sanusi  Selain rekam jejak, saya meyakini bahwa adu gagasan adalah hal yang paling mempengaruhi pemilih menentukan pilihan di Pilpres 2024. Soal pentingnya adu gagasan ini kembali dibuktikan oleh Litbang Kompas yang menyatakan… https://t.co/6Am5X2dkVZ";0;1;13;22;in;48359478;1695760911838122322;Melihat_Indo;https://twitter.com/Melihat_Indo/status/1695760911838122322
Sun Aug 27 11:31:15 +0000 2023;1695760885145567560;"10 tahun ganjar rutin gelar jateng bersholawat #GanjarCapres  THANK YOU INDRA HERLAMBANG #AFFKacau #VindesSport #AFFU23 Fadia Apri #BWC2023 Seo Seung Jae YaSi Besok Senin https://t.co/ArDLwszMqo";0;0;0;0;in;1669249935550865408;1695760869286887568;NusantaraProtec;https://twitter.com/NusantaraProtec/status/1695760885145567560
Sun Aug 27 11:31:13 +0000 2023;1695760876484386958;"Ganjar mendapat dukungan dari para ulama #GanjarCapres  THANK YOU INDRA HERLAMBANG #AFFKacau #VindesSport #AFFU23 Fadia Apri #BWC2023 Seo Seung Jae YaSi Besok Senin https://t.co/lxBmXmeQjK";0;1;0;0;in;1669249935550865408;1695760869286887568;NusantaraProtec;https://twitter.com/NusantaraProtec/status/1695760876484386958
Sun Aug 27 11:31:11 +0000 2023;1695760869286887568;"Ganjar Pranowo sosok ayah teladan dan dikagumi Para Ulama #GanjarCapres  THANK YOU INDRA HERLAMBANG #AFFKacau #VindesSport #AFFU23 Fadia Apri #BWC2023 Seo Seung Jae YaSi Besok Senin https://t.co/v8k2M0Fr6w";0;1;0;0;in;1669249935550865408;1695760869286887568;NusantaraProtec;https://twitter.com/NusantaraProtec/status/1695760869286887568
Sun Aug 27 11:31:00 +0000 2023;1695760823057269077;"@wibisonoys @alisyarief Bisa jadi BS seolah dipecat PDIP, PSI seolah berkhianat ke Ganjar, tapi sejatinya adalah agen penyusup… siapa yg tau?";0;0;0;0;in;1603536827725811712;1695648618978693512;AriskaPutraS;https://twitter.com/AriskaPutraS/status/1695760823057269077
Sun Aug 27 11:30:56 +0000 2023;1695760807769026845;"Jadi kalau ada yang bilang survei selalu dimenangkan krn satu kubu, tampaknya gerombolan pesakitan tersebut harus minum obat dalam dosis yang banyak.  Lihat diatas, diakhir masa jabatan Ganjar keluarkan perda yang menguntungkan masyarakat.";0;0;2;2;in;1276794185425670144;1695760803293786359;AnakLolina2;https://twitter.com/AnakLolina2/status/1695760807769026845
Sun Aug 27 11:30:55 +0000 2023;1695760803293786359;"Yang membuat elektabilitas Ganjar Pranowo selalu stabil bukan krn kuatnya pemberitaan media sosial tapi karena terobosan yang selalu dihadirkan bagi masyarakat.  Setiap aspirasi yang diserap selalu ada solusi yang ditawarkan yang menguntungkan masyarakat. https://t.co/SDeJxHIMmD";0;1;17;23;in;1276794185425670144;1695760803293786359;AnakLolina2;https://twitter.com/AnakLolina2/status/1695760803293786359
Sun Aug 27 11:30:14 +0000 2023;1695760629842493845;"Hoax kubu Prabowo dan Anies gagal total sappo!!!  Mereka terus teriak Ganjar akan diganti dsbnya faktanya dukungan Puan kpd Ganjar begitu sangat besar.  Tetap waspada sappo dgn adu domba mereka. #TerusMajuBersamaGanjar https://t.co/LeeTqDsLpn";0;0;11;32;in;1356517931887120384;1695760629842493845;Anak__Ogi;https://twitter.com/Anak__Ogi/status/1695760629842493845
Sun Aug 27 11:30:10 +0000 2023;1695760613296025759;"Apakah gara-gara partainya gak jadi mutlak dukung Ganjar?";0;0;0;1;in;1259033406333059073;1695760613296025759;ekky1995;https://twitter.com/ekky1995/status/1695760613296025759
Sun Aug 27 11:29:31 +0000 2023;1695760451177701763;"@Arth168 It's very easy to vote for Ganjar when Gerinda's entire presidential campaign is all about military purchases";0;1;0;3;en;300186333;1695753493544649205;lin_linvy;https://twitter.com/lin_linvy/status/1695760451177701763
Sun Aug 27 11:29:27 +0000 2023;1695760432391499896;"@coldbrew165 Nah lu ngapain ngotot kemari?gw gak ngurusin mau jkw mau ganjar mau anies paham?";0;1;0;0;in;1387694010270027777;1695750331576234131;StopPlandemit;https://twitter.com/StopPlandemit/status/1695760432391499896
Sun Aug 27 11:29:10 +0000 2023;1695760361511940220;"@__AnakKolong @psi_id @grace_nat @Giring_Ganesha Mungkin dg jargon Tegak Lurus Bersama Jokowi sdh dianggap memiliki Pak Jokowi dan keluarga sepenuhnya. Dulu mendukung pak Ganjar,langsung pasang baliho tanpa ada komunikasi dg yg bersangkutan,jg ke PDIP,ya wajar klo gak dianggap,etika politiknya gak dipakai. Sbg partai gurem.";0;0;0;2;in;883154678199930880;1695684252275560790;kasito17;https://twitter.com/kasito17/status/1695760361511940220
Sun Aug 27 11:29:01 +0000 2023;1695760321884123428;"@__AnakKolong luar biasa buzzer ganjar, sampai dibela2in upload video lama, teruskan kumur2 nunjuk2 yang lain sementara capresmu mentok";0;0;0;1;in;2290227306;1695750244108317182;majeliskopi08;https://twitter.com/majeliskopi08/status/1695760321884123428
Sun Aug 27 11:28:37 +0000 2023;1695760223498306036;"Ganjar Pranowo penerus program Jokowi #GanjarPranowo2024 #ganjarpresiden2024 #GanjarCapres https://t.co/MKhDNd6vHy";0;0;0;0;in;1660229092489428992;1695760223498306036;ganjar_update;https://twitter.com/ganjar_update/status/1695760223498306036
Sun Aug 27 11:28:32 +0000 2023;1695760200890998875;"RAKYAT INDONESIA SETIA DENGAN GANJAR PRANOWO #GanjarPranowo2024 #ganjarpresiden2024 #GanjarCapres https://t.co/c0nO2UY5tb";0;0;0;0;in;1660229092489428992;1695760200890998875;ganjar_update;https://twitter.com/ganjar_update/status/1695760200890998875
Sun Aug 27 11:28:27 +0000 2023;1695760182037680446;"Ganjar &amp  Prabowo Masih Mau Lawan ANIES ??? 🤣🤣🤣";0;0;0;0;in;1155443417347842048;1695760182037680446;LauHamzah;https://twitter.com/LauHamzah/status/1695760182037680446
Sun Aug 27 11:28:26 +0000 2023;1695760178740875320;"Gubernur Jawa Tengah Ganjar Pranowo menghadiri Gala Dinner 55th ASEAN Economic Ministers (AEM) di Klenteng Sam Poo Kong, Semarang, Minggu (20/8/2023) malam. #GanjarPranowo2024 #ganjarpresiden2024 #GanjarCapres https://t.co/QyBPO3lX5N";0;0;0;0;in;1660229092489428992;1695760178740875320;ganjar_update;https://twitter.com/ganjar_update/status/1695760178740875320
Sun Aug 27 11:28:13 +0000 2023;1695760120968519783;"Dari omongan Johan Budi di Bocor alus PDIP lbh fokus ke pileg, nothing to lose soal Ganjar.. seenggaknya kader2 yg dulu dukung mba Puan. Yg masih semangat 45 sih buzzeRp doang keknya.";0;0;0;0;in;821851706;1695760120968519783;machineheadz;https://twitter.com/machineheadz/status/1695760120968519783
